{
  "schema_version": 1,
  "services_sha": "4eda54b5b42cb89bf69d4c659f589da4481b258e",
  "settlement": "0x9008d19f58aabd9ed0d60971565aa8510560ab41",
  "chain_id": 1,
  "signer": "0xf39fd6e51aad88f6f4ce6ab8827279cfffb92266",
  "order_vector_count": 19,
  "signing_scheme_check_count": 38,
  "vectors": [
    {
      "id": "sell_sb_erc20_bb_erc20",
      "sell_token": "0x0101010101010101010101010101010101010101",
      "buy_token": "0x0202020202020202020202020202020202020202",
      "receiver": "0x0303030303030303030303030303030303030303",
      "sell_amount": "42000000000000000000",
      "buy_amount": "13370000000000000000",
      "valid_to": 1893456000,
      "app_data": "0x93ee614934116c31ec4c24a23881f96ed7054fe09862ebac29bc695500d72587",
      "fee_amount": "1000000000000000000",
      "kind": "sell",
      "partially_fillable": false,
      "sell_token_balance": "erc20",
      "buy_token_balance": "erc20",
      "domain_separator": "0xc078f884a2676e1345748b1feace7b0abee5d00ecadb6e574dcdd109a63e8943",
      "hash_struct": "0xf3e2251b8e69858250fb0507771869c4f1dfcf8d60696eaa8b3a7d06dbb3c74a",
      "eip712_digest": "0x43a2c10e275201196780a82cb9c77566d61edcf46ef7fb38c9388c4b973cea3c",
      "ethsign_digest": "0x904fcd84b97bfeb071367d9553f74516de4f4e59acf2266cc7721e05c4c4505d",
      "eip712_signature": {
        "r": "0x928aef7e9222453f843fef4240756284b6f71fd35b2a71de975fac4330aefc01",
        "s": "0x557c1cc8ae6e1aa291ae8fd524484fa2329a0c021bd74dea2320937b7aaeede1",
        "v": 28
      },
      "eip712_recovered_owner": "0xf39fd6e51aad88f6f4ce6ab8827279cfffb92266",
      "ethsign_signature": {
        "r": "0xb409e98312e8f36aea33fe8c74423a51d200db574b20475e497a6bc670c85acb",
        "s": "0x36bdc11c66ca4c9b3cf2476f5c382af77d2255ea773dd656a0954073231f58e6",
        "v": 27
      },
      "ethsign_recovered_owner": "0xf39fd6e51aad88f6f4ce6ab8827279cfffb92266",
      "uid": "0x43a2c10e275201196780a82cb9c77566d61edcf46ef7fb38c9388c4b973cea3cf39fd6e51aad88f6f4ce6ab8827279cfffb9226670dbd880"
    },
    {
      "id": "sell_sb_erc20_bb_internal",
      "sell_token": "0x0101010101010101010101010101010101010101",
      "buy_token": "0x0202020202020202020202020202020202020202",
      "receiver": "0x0303030303030303030303030303030303030303",
      "sell_amount": "42000000000000000000",
      "buy_amount": "13370000000000000000",
      "valid_to": 1893456000,
      "app_data": "0x93ee614934116c31ec4c24a23881f96ed7054fe09862ebac29bc695500d72587",
      "fee_amount": "1000000000000000000",
      "kind": "sell",
      "partially_fillable": false,
      "sell_token_balance": "erc20",
      "buy_token_balance": "internal",
      "domain_separator": "0xc078f884a2676e1345748b1feace7b0abee5d00ecadb6e574dcdd109a63e8943",
      "hash_struct": "0x6a076a781dfaa534cba25d5b4ab5d0888c767111908e47c00109b3c385479322",
      "eip712_digest": "0xfbafb43a85b3520928347f9ec51c6da511f39b744ec94c9aded8b487d6fc87f1",
      "ethsign_digest": "0xc14c8b210a6037263e40c06005835dd48d9e533fd9cb77c05bd836e4fe3aae0a",
      "eip712_signature": {
        "r": "0x791c0c09adcf2d2320671eed4dbe74adc66b273aee4acd9313d374259ebdef6c",
        "s": "0x07ff4972fc8136657caae426a2bc3bdc0dcfae336e9761f082ae2d8b01f0733b",
        "v": 28
      },
      "eip712_recovered_owner": "0xf39fd6e51aad88f6f4ce6ab8827279cfffb92266",
      "ethsign_signature": {
        "r": "0x259acc0d3f5f306004b00e5ec1619ad7cba999b06af5b1e5963de80a0c960aa5",
        "s": "0x5f502381806c503ef431f75c62103dcc2907f4f1cd96bbd1702a00b7a7871828",
        "v": 27
      },
      "ethsign_recovered_owner": "0xf39fd6e51aad88f6f4ce6ab8827279cfffb92266",
      "uid": "0xfbafb43a85b3520928347f9ec51c6da511f39b744ec94c9aded8b487d6fc87f1f39fd6e51aad88f6f4ce6ab8827279cfffb9226670dbd880"
    },
    {
      "id": "sell_sb_external_bb_erc20",
      "sell_token": "0x0101010101010101010101010101010101010101",
      "buy_token": "0x0202020202020202020202020202020202020202",
      "receiver": "0x0303030303030303030303030303030303030303",
      "sell_amount": "42000000000000000000",
      "buy_amount": "13370000000000000000",
      "valid_to": 1893456000,
      "app_data": "0x93ee614934116c31ec4c24a23881f96ed7054fe09862ebac29bc695500d72587",
      "fee_amount": "1000000000000000000",
      "kind": "sell",
      "partially_fillable": false,
      "sell_token_balance": "external",
      "buy_token_balance": "erc20",
      "domain_separator": "0xc078f884a2676e1345748b1feace7b0abee5d00ecadb6e574dcdd109a63e8943",
      "hash_struct": "0xeb8c033b2919ae52d14651de1b67bb14ce9f20aa1fc49e427caa18d576db5164",
      "eip712_digest": "0xf5d5bef2314d83ce315a0d1355f58eb08d91f8fbabf5983311ec2bfa46b2329f",
      "ethsign_digest": "0x95a12c2ff7f47031724a150eae878bf2abae12c538b4bad3b590b5f5426fb853",
      "eip712_signature": {
        "r": "0x799db999a9eccb3e628e6cea81c205b584a6294d4adcd07d021332af38ecc209",
        "s": "0x60f06a89cd5479c903c0c9fc69b1a92233388261ae809742b7a5061079744ca7",
        "v": 28
      },
      "eip712_recovered_owner": "0xf39fd6e51aad88f6f4ce6ab8827279cfffb92266",
      "ethsign_signature": {
        "r": "0x9a4d0f2816b8579f57434082c204d831b2475e06be6af356669a31a6865d905f",
        "s": "0x38fe876117834e4e84e134c629535a3ff4f5df619620a0df3f7da38c5807c0dc",
        "v": 28
      },
      "ethsign_recovered_owner": "0xf39fd6e51aad88f6f4ce6ab8827279cfffb92266",
      "uid": "0xf5d5bef2314d83ce315a0d1355f58eb08d91f8fbabf5983311ec2bfa46b2329ff39fd6e51aad88f6f4ce6ab8827279cfffb9226670dbd880"
    },
    {
      "id": "sell_sb_external_bb_internal",
      "sell_token": "0x0101010101010101010101010101010101010101",
      "buy_token": "0x0202020202020202020202020202020202020202",
      "receiver": "0x0303030303030303030303030303030303030303",
      "sell_amount": "42000000000000000000",
      "buy_amount": "13370000000000000000",
      "valid_to": 1893456000,
      "app_data": "0x93ee614934116c31ec4c24a23881f96ed7054fe09862ebac29bc695500d72587",
      "fee_amount": "1000000000000000000",
      "kind": "sell",
      "partially_fillable": false,
      "sell_token_balance": "external",
      "buy_token_balance": "internal",
      "domain_separator": "0xc078f884a2676e1345748b1feace7b0abee5d00ecadb6e574dcdd109a63e8943",
      "hash_struct": "0xab7789b9ac8af46fde1d66bf7ceedc40374e419c8bd842e6bd85690aa7645fdb",
      "eip712_digest": "0xfc0b918ec7a0f6525fdbb4e91d4a7ef71e18b46e0111fc4516e6de11c05f42f0",
      "ethsign_digest": "0x30f32c6f3cbe5cf756beeca0f808a9de2d294df7319353fac7d790339c6c1022",
      "eip712_signature": {
        "r": "0x3d48ce123dd2490369f27a98a1fc8f4aa1900f44dddf6fa241fde1d1f3782c0e",
        "s": "0x22d190346995a946270231e223af6665265cfb1879e05dcb2c489071071ed327",
        "v": 28
      },
      "eip712_recovered_owner": "0xf39fd6e51aad88f6f4ce6ab8827279cfffb92266",
      "ethsign_signature": {
        "r": "0xba75f731fe352670ad80609f5533482c359fde6c569ce7f1da2b4161b7fa911a",
        "s": "0x21050a77f35c13c1cf5745b56f207a24dbce53711b3a356c0c5817f08a317e47",
        "v": 27
      },
      "ethsign_recovered_owner": "0xf39fd6e51aad88f6f4ce6ab8827279cfffb92266",
      "uid": "0xfc0b918ec7a0f6525fdbb4e91d4a7ef71e18b46e0111fc4516e6de11c05f42f0f39fd6e51aad88f6f4ce6ab8827279cfffb9226670dbd880"
    },
    {
      "id": "sell_sb_internal_bb_erc20",
      "sell_token": "0x0101010101010101010101010101010101010101",
      "buy_token": "0x0202020202020202020202020202020202020202",
      "receiver": "0x0303030303030303030303030303030303030303",
      "sell_amount": "42000000000000000000",
      "buy_amount": "13370000000000000000",
      "valid_to": 1893456000,
      "app_data": "0x93ee614934116c31ec4c24a23881f96ed7054fe09862ebac29bc695500d72587",
      "fee_amount": "1000000000000000000",
      "kind": "sell",
      "partially_fillable": false,
      "sell_token_balance": "internal",
      "buy_token_balance": "erc20",
      "domain_separator": "0xc078f884a2676e1345748b1feace7b0abee5d00ecadb6e574dcdd109a63e8943",
      "hash_struct": "0xd667d9d22250dbc22238c361446dcfc725ce3986ee06d6c9e45e5605e98f812a",
      "eip712_digest": "0xc3e6b468bbeed1b4d95a162d4c139394d6445ff737b392568cc4e8056bbaff6c",
      "ethsign_digest": "0x46d122b78e6f0a7a102f300c0caf44a589a7d3d78747f3a8c70d53a731a71cbe",
      "eip712_signature": {
        "r": "0x0ade96234b4e6eb9de7764bdf4790fd271519ea9145f656827b7038bcf6f43c1",
        "s": "0x3140e3a5438ea48168c633e38d1755e62cd1fe129cd2a376521a300257cf4497",
        "v": 27
      },
      "eip712_recovered_owner": "0xf39fd6e51aad88f6f4ce6ab8827279cfffb92266",
      "ethsign_signature": {
        "r": "0x889e91e0154fd9c5bdba011c193008c68e1b900b357c6b0228531a225812675c",
        "s": "0x66c6bff65f3de07160b3c823e998bb030dc9ca56c560391f8ca1ca23e901e579",
        "v": 28
      },
      "ethsign_recovered_owner": "0xf39fd6e51aad88f6f4ce6ab8827279cfffb92266",
      "uid": "0xc3e6b468bbeed1b4d95a162d4c139394d6445ff737b392568cc4e8056bbaff6cf39fd6e51aad88f6f4ce6ab8827279cfffb9226670dbd880"
    },
    {
      "id": "sell_sb_internal_bb_internal",
      "sell_token": "0x0101010101010101010101010101010101010101",
      "buy_token": "0x0202020202020202020202020202020202020202",
      "receiver": "0x0303030303030303030303030303030303030303",
      "sell_amount": "42000000000000000000",
      "buy_amount": "13370000000000000000",
      "valid_to": 1893456000,
      "app_data": "0x93ee614934116c31ec4c24a23881f96ed7054fe09862ebac29bc695500d72587",
      "fee_amount": "1000000000000000000",
      "kind": "sell",
      "partially_fillable": false,
      "sell_token_balance": "internal",
      "buy_token_balance": "internal",
      "domain_separator": "0xc078f884a2676e1345748b1feace7b0abee5d00ecadb6e574dcdd109a63e8943",
      "hash_struct": "0xf3f4ea8c77be62f342eb3ad125f9c6d8098eb75848ae1cdc107d223b9e29d717",
      "eip712_digest": "0x871eebde859f91130f31e5a2174161bcdb6630f80d0d82dde557cf4c881c7804",
      "ethsign_digest": "0xaaa16e2e62c86fa420ad50d19dd15ce0c684b548b25b28784d58a1364c81bcdb",
      "eip712_signature": {